<?xml version="1.0" encoding="UTF-8"?>
<publications xmlns:xsi="http://www.w3.org/2001/XMLSchema-instance"
              xmlns="http://www.example.org/publication"
              xsi:schemaLocation="http://www.example.org/publication publication.xsd">

    <publication id="1">
        <title>Epam-magazine</title>
        <type>MAGAZINE</type>
        <monthly>true</monthly>
        <Chars>
            <color>true</color>
            <page-qty>567</page-qty>
            <glance>false</glance>
            <index>true</index>
        </Chars>
    </publication>

    <publication id="2">
        <title>Epam-magazine</title>
        <type>MAGAZINE</type>
        <monthly>true</monthly>
        <Chars>
            <color>true</color>
            <page-qty>567</page-qty>
            <glance>false</glance>
            <index>true</index>
        </Chars>
    </publication>

    <publication id="3">
        <title>Epam-magazine</title>
        <type>MAGAZINE</type>
        <monthly>true</monthly>
        <Chars>
            <color>true</color>
            <page-qty>567</page-qty>
            <glance>false</glance>
            <index>true</index>
        </Chars>
    </publication>

    <publication id="4">
        <title>Epam-magazine</title>
        <type>MAGAZINE</type>
        <monthly>true</monthly>
        <Chars>
            <color>true</color>
            <page-qty>567</page-qty>
            <glance>false</glance>
            <index>true</index>
        </Chars>
    </publication>

    <publication id="5">
        <title>Epam-magazine</title>
        <type>MAGAZINE</type>
        <monthly>true</monthly>
        <Chars>
            <color>true</color>
            <page-qty>567</page-qty>
            <glance>false</glance>
            <index>true</index>
        </Chars>
    </publication>

    <publication id="6">
        <title>Epam-magazine</title>
        <type>MAGAZINE</type>
        <monthly>true</monthly>
        <Chars>
            <color>true</color>
            <page-qty>567</page-qty>
            <glance>false</glance>
            <index>true</index>
        </Chars>
    </publication>

    <publication id="7">
        <title>Epam-magazine</title>
        <type>MAGAZINE</type>
        <monthly>true</monthly>
        <Chars>
            <color>true</color>
            <page-qty>567</page-qty>
            <glance>false</glance>
            <index>true</index>
        </Chars>
    </publication>

    <publication id="8">
        <title>Epam-magazine</title>
        <type>MAGAZINE</type>
        <monthly>true</monthly>
        <Chars>
            <color>true</color>
            <page-qty>567</page-qty>
            <glance>false</glance>
            <index>true</index>
        </Chars>
    </publication>

    <publication id="9">
        <title>Epam-magazine</title>
        <type>MAGAZINE</type>
        <monthly>true</monthly>
        <Chars>
            <color>true</color>
            <page-qty>567</page-qty>
            <glance>false</glance>
            <index>true</index>
        </Chars>
    </publication>

    <publication id="10">
        <title>Epam-magazine</title>
        <type>MAGAZINE</type>
        <monthly>true</monthly>
        <Chars>
            <color>true</color>
            <page-qty>567</page-qty>
            <glance>false</glance>
            <index>true</index>
        </Chars>
    </publication>

    <publication id="11">
        <title>Epam-magazine</title>
        <type>MAGAZINE</type>
        <monthly>true</monthly>
        <Chars>
            <color>true</color>
            <page-qty>567</page-qty>
            <glance>false</glance>
            <index>true</index>
        </Chars>
    </publication>

    <publication id="12">
        <title>Epam-magazine</title>
        <type>MAGAZINE</type>
        <monthly>true</monthly>
        <Chars>
            <color>true</color>
            <page-qty>567</page-qty>
            <glance>false</glance>
            <index>true</index>
        </Chars>
    </publication>

    <publication id="13">
        <title>Epam-magazine</title>
        <type>MAGAZINE</type>
        <monthly>true</monthly>
        <Chars>
            <color>true</color>
            <page-qty>567</page-qty>
            <glance>false</glance>
            <index>true</index>
        </Chars>
    </publication>

    <publication id="14">
        <title>Epam-magazine</title>
        <type>MAGAZINE</type>
        <monthly>true</monthly>
        <Chars>
            <color>true</color>
            <page-qty>567</page-qty>
            <glance>false</glance>
            <index>true</index>
        </Chars>
    </publication>

    <publication id="15">
        <title>Epam-magazine</title>
        <type>MAGAZINE</type>
        <monthly>true</monthly>
        <Chars>
            <color>true</color>
            <page-qty>567</page-qty>
            <glance>false</glance>
            <index>true</index>
        </Chars>
    </publication>

    <publication id="16">
        <title>Epam-magazine</title>
        <type>MAGAZINE</type>
        <monthly>true</monthly>
        <Chars>
            <color>true</color>
            <page-qty>567</page-qty>
            <glance>false</glance>
            <index>true</index>
        </Chars>
    </publication>

</publications>
